{
  "$schema": "https://json-schema.org/draft/2020-12/schema",
  "$id": "https://udlm.dev/registry/udlm/0.1/provider-adopted-standards.schema.json",
  "title": "UDLM Provider — Capability Declaration (adopted standards + docs/spec/foundations/mobility/operational/sovereignty)",
  "description": "The provider-authored capability declaration (adopted-standards.md §3.2, the control plane ADS-001; ADR-PROV-002). Carries (a) `adopted_standard_support` — which versions of each adopted external standard the provider can emit/consume — and (b) `capabilities`: the provider's declared, VERSIONED, accreditable capabilities. A capability is the accreditation/version unit (its `capability_uuid` + `version` is what an accreditation binds to, docs/spec/governance/accreditation-and-authorization-matrix.md §3.3.1) and may realize MORE THAN ONE `(verb × domain)` category (ADR-PROV-002); docs/spec/foundations/mobility/operational/sovereignty vary per category WITHIN it (ADR-PROV-002 — the accreditable unit is coarser than the per-category grain). Per-category blocks OVERRIDE `provider_defaults` (finest-granularity-wins, DCM ADR-004 §0/§4). This is DATA; matching/negotiation and the 1-1 claim↔accreditation reconciliation are Policy (the control plane).",
  "type": "object",
  "additionalProperties": false,
  "required": [
    "provider",
    "adopted_standard_support"
  ],
  "properties": {
    "provider": {
      "type": "object",
      "additionalProperties": false,
      "required": [
        "name",
        "uuid",
        "version"
      ],
      "properties": {
        "name": {
          "type": "string"
        },
        "uuid": {
          "$ref": "common-elements.schema.json#/$defs/uuid_v4",
          "description": "RFC 9562 v4 identity of the provider — FROZEN at registration, never rotated on edit (ADR-051): this is the `subject_uuid` an accreditation attests against (accreditation §3.3.1 axis 1), and an anchor that moved on edits would orphan every attestation bound to it. There is no revision field here — revision exactness lives in digests, recorded by the attesting/consuming side."
        },
        "kind": {
          "enum": [
            "service",
            "information",
            "composite"
          ],
          "description": "Provider type (provider-contract.md). A provider may emit adopted-standard data in its Information-Provider role even when it also provisions (service)."
        },
        "version": {
          "type": "string",
          "pattern": "^[0-9]+\\.[0-9]+\\.[0-9]+$",
          "description": "The provider definition's version — the declared surface (capabilities, adopted standards, defaults, populated outputs) is the versioned contract under the standard rules (ADR-045 §8): internal changes past the naturalization boundary (dcm DCM ADR-023) are free; surface changes classify and bump under the publish law (ADR-051 — the uuid stays frozen; (identity, version) is immutable once published)."
        }
      }
    },
    "adopted_standard_support": {
      "type": "array",
      "minItems": 1,
      "description": "One entry per adopted standard this provider supports.",
      "items": {
        "$ref": "#/$defs/standard_support"
      }
    },
    "provider_defaults": {
      "type": "object",
      "additionalProperties": false,
      "description": "Provider-level DEFAULT blocks (ADR-PROV-002 §0/§4). Any per-category block on a capability OVERRIDES these for that category (finest-granularity-wins). Optional — a provider whose whole offering shares one stance sets it here; a multi-category provider overrides per category.",
      "properties": {
        "sovereignty": {
          "$ref": "#/$defs/sovereignty"
        },
        "topology_capability": {
          "$ref": "#/$defs/topology_capability"
        },
        "operational_capability": {
          "$ref": "#/$defs/operational_capability"
        },
        "conformance_claims": {
          "type": "array",
          "items": {
            "$ref": "#/$defs/conformance_claim"
          },
          "description": "Provider-wide DECLARED standards adherence (self-declared). A per-capability entry may add/override; each claim is trusted only when an accreditation attests it (§3.7)."
        }
      }
    },
    "capabilities": {
      "type": "array",
      "description": "The provider's declared, versioned, accreditable capabilities (ADR-PROV-002). Each is the accreditation/version unit and realizes one or more `(verb × domain)` categories.",
      "items": {
        "$ref": "#/$defs/capability"
      }
    }
  },
  "$defs": {
    "standard_support": {
      "type": "object",
      "additionalProperties": false,
      "required": [
        "standard",
        "supports",
        "direction"
      ],
      "properties": {
        "standard": {
          "type": "string",
          "description": "External standard name, e.g. FOCUS, OpenCost, OSCAL, SCIM."
        },
        "supports": {
          "type": "string",
          "minLength": 1,
          "description": "The version range/pins the provider can serve — a pin (\"1.4\"), wildcard (\"1.x\"), or range (\">=1.2 <2.0\"). RANGE RESOLUTION is Policy (the control plane ADS-003), not the schema."
        },
        "preferred": {
          "type": "string",
          "description": "The concrete version the provider prefers within `supports`."
        },
        "direction": {
          "enum": [
            "emit",
            "consume",
            "both"
          ],
          "description": "Whether the provider produces the standard's data, consumes it, or both."
        }
      }
    },
    "capability": {
      "type": "object",
      "additionalProperties": false,
      "required": [
        "capability_uuid",
        "version",
        "categories"
      ],
      "description": "One declared, VERSIONED, accreditable capability — the accreditation/version unit (DCM ADR-004 §5; accreditation §3.3.1 grain 3 binds `capability_uuid` + `version`). It realizes one or more `(verb × domain)` categories; docs/spec/foundations/mobility/operational/sovereignty are per-category, WITHIN this capability.",
      "properties": {
        "capability_uuid": {
          "$ref": "common-elements.schema.json#/$defs/uuid_v4",
          "description": "Stable RFC 9562 v4 identity of this capability — FROZEN at declaration, never rotated on edit (ADR-051): the anchor an accreditation binds to (accreditation §3.3.1) survives every surface change; only the version moves."
        },
        "version": {
          "type": "string",
          "pattern": "^[0-9]+\\.[0-9]+\\.[0-9]+$",
          "description": "Immutable-once-published version (VERSIONING.md). Bumped on ANY change to its attested surface (any category's docs/spec/foundations/mobility/operational/sovereignty/resource_types); a grain-3 accreditation covers exactly this version, so a bump expires it until re-attested."
        },
        "name": {
          "type": "string",
          "description": "Advisory human label for the capability/offering (e.g. \"EU Sovereign Compute\"). uuid is authoritative."
        },
        "categories": {
          "type": "array",
          "minItems": 1,
          "description": "The `(verb × domain)` categories (ADR-PROV-002) this capability realizes, each carrying its own docs/spec/foundations/mobility/operational/sovereignty. Two entries may share a category with different resource_types when a finer split is needed.",
          "items": {
            "$ref": "#/$defs/category_scope"
          }
        },
        "covers_types": {
          "type": "array",
          "items": {
            "type": "string",
            "pattern": "^[A-Z][A-Za-z]*(\\.[A-Z][A-Za-z]*)*$"
          },
          "description": "The resource types this capability's contract covers (explicit capability<->type linkage, ADR-045 §8 two-plane versioning): a capability change reaches exactly the consumers bound through these types, which is what makes classification blast radius computable and refusals able to name the bound consumers. A provider realizing a type no capability covers is a declare-and-select violation."
        }
      }
    },
    "category_scope": {
      "type": "object",
      "additionalProperties": false,
      "required": [
        "category"
      ],
      "description": "What a capability offers for one `(verb × domain)` category — the grain at which docs/spec/foundations/sovereignty vary (ADR-PROV-002). Blocks omitted here inherit `provider_defaults`.",
      "properties": {
        "category": {
          "type": "string",
          "description": "The `(verb × domain)` capability category, e.g. realize_resources/Machine (ADR-PROV-002)."
        },
        "resource_types": {
          "type": "array",
          "items": {
            "type": "string",
            "pattern": "^[A-Z][A-Za-z0-9]+(\\.[A-Z][A-Za-z0-9]+)?$"
          },
          "description": "The resource types realized within this category."
        },
        "topology_capability": {
          "$ref": "#/$defs/topology_capability"
        },
        "mobility": {
          "type": "array",
          "items": {
            "$ref": "#/$defs/mobility_entry"
          }
        },
        "operational_capability": {
          "$ref": "#/$defs/operational_capability"
        },
        "sovereignty": {
          "$ref": "#/$defs/sovereignty"
        },
        "conformance_claims": {
          "type": "array",
          "items": {
            "$ref": "#/$defs/conformance_claim"
          },
          "description": "Standards/frameworks this scope DECLARES adherence to (self-declared; accreditation §3.7). Each is a claim, trusted only when an accreditation attests its framework for this scope."
        },
        "instance_size_catalog": {
          "type": "array",
          "description": "The provider's size-class → raw-resources mapping for this category (ADR-014; provider-contract.md §8.1a — the abstract↔precise bridge). The class VOCABULARY + ordering is UDLM (comparable/portable across providers); this MAPPING is the provider's (it owns what its 'medium' resolves to); the control plane resolves instance_size → raw here for placement + comparison against raw requirements. Declared, not live-queried.",
          "items": {
            "type": "object",
            "additionalProperties": false,
            "required": [
              "class"
            ],
            "properties": {
              "class": {
                "type": "string",
                "description": "Provider-neutral size class (e.g. small|medium|large|xlarge) — the comparable UDLM vocabulary (common-elements §2.2)."
              },
              "resources": {
                "type": "object",
                "additionalProperties": true,
                "description": "The raw resources this class resolves to FOR THIS PROVIDER (e.g. { vcpu: { count }, memory: { size } })."
              }
            }
          }
        }
      }
    },
    "topology_capability": {
      "type": "object",
      "additionalProperties": false,
      "description": "The topologies this category can FULFILL (DCM ADR-004 §1) — NOT a Topology instance (which is realized/discovered, DCM ADR-001).",
      "properties": {
        "kinds_supported": {
          "type": "array",
          "items": {
            "type": "string"
          },
          "description": "Abstract failure/locality kinds it can guarantee separation across (region|zone|rack|host|power_domain|network_segment ...). [] = no failure-domain concept → fails any spread constraint."
        },
        "native_mapping": {
          "type": "object",
          "additionalProperties": {
            "type": "string"
          },
          "description": "native → abstract kind (naturalization), e.g. { \"zone\": \"aws-az\" }."
        },
        "jurisdictions": {
          "type": "array",
          "items": {
            "type": "string"
          },
          "description": "Residency/sovereignty coverage as a PLACEMENT input (where it can spread); the authorization stance is `sovereignty`."
        },
        "max_separation": {
          "type": "string",
          "description": "Strongest anti-affinity kind it can promise."
        },
        "reference_topologies": {
          "type": "array",
          "items": {
            "type": "string"
          },
          "description": "Optional named topology archetypes it can fulfill."
        }
      }
    },
    "mobility_entry": {
      "type": "object",
      "additionalProperties": false,
      "required": [
        "resource_type",
        "methods"
      ],
      "description": "Data portability/migration capability for a resource type (ADR-003 §3 / ADR-PROV-002).",
      "properties": {
        "resource_type": {
          "type": "string",
          "pattern": "^[A-Z][A-Za-z0-9]+(\\.[A-Z][A-Za-z0-9]+)?$"
        },
        "methods": {
          "type": "array",
          "items": {
            "type": "string"
          },
          "description": "e.g. online-streaming, snapshot-ship."
        },
        "guarantees": {
          "type": "object",
          "additionalProperties": true,
          "properties": {
            "rpo_min": {
              "type": "string"
            },
            "cross_region": {
              "type": "boolean"
            },
            "online": {
              "type": "boolean"
            }
          }
        }
      }
    },
    "operational_capability": {
      "type": "object",
      "additionalProperties": true,
      "description": "SRE-pattern primitives (DCM ADR-004 §3). Open (additionalProperties) so a provider can advertise more; the named ones feed fault-domain gating, rehearsal validation (T6), and rolling cutover.",
      "properties": {
        "drain": {
          "type": "boolean"
        },
        "maintenance_mode": {
          "type": "boolean"
        },
        "online_migrate": {
          "type": "boolean"
        },
        "rolling_update": {
          "type": "boolean"
        },
        "rehearsal_support": {
          "type": "array",
          "items": {
            "type": "string"
          }
        },
        "health_reporting": {
          "type": "array",
          "items": {
            "type": "string"
          }
        }
      }
    },
    "sovereignty": {
      "type": "object",
      "additionalProperties": false,
      "description": "The residency/sovereignty STANCE for this category (accreditation-and-authorization-matrix.md §3.3.1). Overrides the provider default (finest wins). This is a CLAIM: trust requires a 1-1 match with an accreditation attesting exactly this scope (accreditation §3.3.1) — declaring it here does not by itself make it trusted, and it obligates the provider to guarantee it down the whole realization pipeline for the category.",
      "properties": {
        "operating_jurisdictions": {
          "type": "array",
          "items": {
            "type": "string"
          },
          "description": "The legal SOVEREIGNTY regime(s) — matched EXACTLY (§3.8), not subsumed. ISO 3166."
        },
        "data_residency_zones": {
          "type": "array",
          "items": {
            "type": "string"
          },
          "description": "Physical RESIDENCY zones — subsume DOWN a declared jurisdiction hierarchy (a US zone covers US-MN, §3.8)."
        },
        "enforcement_plane": {
          "enum": [
            "data",
            "control",
            "both"
          ],
          "default": "both",
          "description": "Which plane the provider commits to enforce this stance on (accreditation §3.8). The control plane does NOT enforce residency at the byte level — it conveys the sovereignty requirement + the role:execution data slice (docs/spec/contracts/data-roles.md) to the provider, and the provider's accreditation (§3.7, matching `plane`) attests it enforces at the DATA plane. The control-plane path (operator access / support / telemetry) is the universal leak; a data-only stance does not cover it."
        },
        "sub_processors": {
          "type": "array",
          "items": {
            "type": "string"
          },
          "description": "Third parties with data access — themselves bound by the propagated sovereignty constraint (accreditation-and-authorization-matrix.md §3.3.1)."
        }
      }
    },
    "conformance_claim": {
      "type": "object",
      "additionalProperties": false,
      "required": [
        "framework"
      ],
      "description": "A DECLARED adherence to a standard/framework — the subject's self-declaration (accreditation §3.7; Gaia-X self-description / OSCAL SSP model). A CLAIM: trusted only when an accreditation with a matching `framework` attests this scope (the same claim→attestation link as sovereignty). An accreditation ties back to it by `framework` + scope.",
      "properties": {
        "framework": {
          "type": "string",
          "description": "The standard/framework claimed, e.g. iso_27001, soc2_type2, fedramp_moderate, gdpr, secnumcloud_3.2, c5."
        },
        "level": {
          "type": "string",
          "description": "Optional level/tier within the framework (e.g. Moderate, L3)."
        },
        "statement": {
          "type": "string",
          "description": "Optional human statement of the adherence + its scope."
        }
      }
    }
  }
}
